{
  "tourId": "brighton-emily-001",
  "modelId": "brighton-emily",
  "title": "Brighton Emily",
  "address": "Brighton, VIC",
  "price": "Contact agent",
  "rooms": "4",
  "area": "320 sqm",
  "modelEntryUrl": "https://pub-d4bafeab4e3548ea8031bf9046e80057.r2.dev/models/meta.lcc",
  "startMode": "orbit",
  "defaultPresetId": "",
  "slug": "brighton-emily",
  "status": "draft",
  "cameraPresets": [],
  "hotspots": []
}
